{
  "$schema": "http://json-schema.org/draft-07/schema#",
  "$id": "https://utsu-ri.dev/schemas/config/v1",
  "title": "UtsuriConfig",
  "type": "object",
  "additionalProperties": false,
  "required": ["version", "project", "diff", "execution", "report", "review", "feedback", "policy"],
  "properties": {
    "version": { "const": 1 },
    "project": {
      "type": "object",
      "additionalProperties": false,
      "required": ["name"],
      "properties": {
        "name": { "type": "string", "minLength": 1 },
        "locale": { "type": "string", "minLength": 2 }
      }
    },
    "proposedCommands": {
      "type": "array",
      "items": {
        "type": "object",
        "additionalProperties": false,
        "required": ["source", "command", "reason"],
        "properties": {
          "source": { "type": "string", "minLength": 1 },
          "command": {
            "type": "array",
            "minItems": 1,
            "items": { "type": "string", "minLength": 1 }
          },
          "reason": { "type": "string", "minLength": 1 }
        }
      }
    },
    "diff": {
      "type": "object",
      "additionalProperties": false,
      "required": ["base", "head"],
      "properties": {
        "base": { "type": "string", "minLength": 1 },
        "head": { "type": "string", "minLength": 1 },
        "mergeBase": { "type": "boolean", "default": true },
        "include": { "type": "array", "items": { "type": "string" }, "uniqueItems": true },
        "exclude": { "type": "array", "items": { "type": "string" }, "uniqueItems": true },
        "generatedPatterns": {
          "type": "array",
          "items": { "type": "string" },
          "uniqueItems": true
        }
      }
    },
    "execution": {
      "type": "object",
      "additionalProperties": false,
      "required": ["mode", "trust", "install", "shell", "timeoutMs"],
      "properties": {
        "mode": {
          "enum": ["dual-url", "static-fragment", "worktree", "container"],
          "default": "dual-url"
        },
        "trust": { "enum": ["untrusted", "configured", "trusted"] },
        "install": { "const": "never" },
        "shell": { "const": false },
        "timeoutMs": { "type": "integer", "minimum": 1, "maximum": 900000 }
      }
    },
    "servers": {
      "type": "object",
      "additionalProperties": false,
      "properties": {
        "before": { "$ref": "#/$defs/server" },
        "after": { "$ref": "#/$defs/server" }
      }
    },
    "browser": {
      "type": "object",
      "additionalProperties": false,
      "properties": {
        "engine": { "const": "chromium" },
        "headless": { "type": "boolean" },
        "serviceWorkers": { "const": "block" },
        "locale": { "type": "string" },
        "timezone": { "type": "string" },
        "colorScheme": { "enum": ["light", "dark"] },
        "reducedMotion": { "enum": ["reduce", "no-preference"] }
      }
    },
    "viewports": {
      "type": "object",
      "additionalProperties": { "$ref": "#/$defs/viewport" }
    },
    "targets": {
      "type": "array",
      "items": { "$ref": "#/$defs/target" }
    },
    "stabilization": {
      "type": "object",
      "additionalProperties": false,
      "properties": {
        "disableAnimations": { "type": "boolean", "default": true },
        "hideCaret": { "type": "boolean", "default": true },
        "waitForFonts": { "type": "boolean", "default": true },
        "freezeTime": { "type": "string", "format": "date-time" },
        "waitAfterReadyMs": { "type": "integer", "minimum": 0, "maximum": 5000 },
        "maxRetries": { "type": "integer", "minimum": 0, "maximum": 1 },
        "masks": {
          "type": "array",
          "items": {
            "type": "object",
            "additionalProperties": false,
            "required": ["selector", "reason"],
            "properties": {
              "selector": { "type": "string", "minLength": 1 },
              "reason": { "type": "string", "minLength": 1 }
            }
          }
        }
      }
    },
    "network": {
      "type": "object",
      "additionalProperties": false,
      "properties": {
        "browserPolicy": { "const": "block-external" },
        "allowedOrigins": {
          "type": "array",
          "items": { "type": "string", "format": "uri" },
          "uniqueItems": true
        },
        "blockMethods": {
          "type": "array",
          "items": { "enum": ["POST", "PUT", "PATCH", "DELETE"] },
          "uniqueItems": true
        },
        "recordBlocked": { "type": "boolean" }
      }
    },
    "security": {
      "type": "object",
      "additionalProperties": false,
      "properties": {
        "envAllowlist": { "type": "array", "items": { "type": "string" }, "uniqueItems": true },
        "followSymlinks": { "const": false },
        "allowArbitraryScriptSteps": { "const": false },
        "allowRemoteAuthState": { "const": false },
        "sanitizeHtmlPreview": { "const": true }
      }
    },
    "capture": {
      "type": "object",
      "additionalProperties": false,
      "properties": {
        "fullPage": { "type": "boolean", "default": true },
        "elementCrops": { "type": "boolean", "default": true },
        "maxFullPageHeight": { "type": "integer", "minimum": 1, "maximum": 100000 },
        "maxMegapixels": { "type": "number", "exclusiveMinimum": 0, "maximum": 500 },
        "screenshotFormat": { "const": "png" },
        "includeDom": { "const": "normalized" },
        "includeRawDom": { "const": false },
        "includeAria": { "type": "boolean" },
        "includeComputedStyles": { "enum": ["changed-and-layout", "layout"] },
        "includeAxe": { "type": "boolean" }
      }
    },
    "discovery": {
      "type": "object",
      "additionalProperties": false,
      "properties": {
        "knownUsages": { "type": ["integer", "null"], "minimum": 0 },
        "unknownPossible": { "type": "boolean" },
        "mappings": {
          "type": "array",
          "items": {
            "type": "object",
            "additionalProperties": false,
            "required": ["targetId", "reason"],
            "properties": {
              "targetId": { "type": "string", "pattern": "^[a-z0-9][a-z0-9-]*$" },
              "changedPaths": {
                "type": "array",
                "items": { "type": "string", "minLength": 1 },
                "uniqueItems": true
              },
              "reason": { "type": "string", "minLength": 1 },
              "knownUsageCount": { "type": "integer", "minimum": 0 }
            }
          }
        },
        "sources": {
          "type": "object",
          "additionalProperties": false,
          "properties": {
            "storybookIndex": { "type": "string", "minLength": 1 },
            "playwrightManifest": { "type": "string", "minLength": 1 },
            "routeManifest": { "type": "string", "minLength": 1 },
            "importGraph": { "type": "string", "minLength": 1 },
            "selectorUsage": { "type": "string", "minLength": 1 }
          }
        }
      }
    },
    "report": {
      "type": "object",
      "additionalProperties": false,
      "required": ["outputDirectory", "singleFile", "includeAbsolutePaths"],
      "properties": {
        "outputDirectory": { "type": "string", "minLength": 1 },
        "language": { "type": "string", "minLength": 2 },
        "theme": { "enum": ["system", "light", "dark"] },
        "singleFile": { "type": "boolean" },
        "includeReviewNotes": { "type": "boolean" },
        "includeRawLogs": { "type": "boolean" },
        "includeAbsolutePaths": { "const": false }
      }
    },
    "review": {
      "type": "object",
      "additionalProperties": false,
      "required": ["enabled", "autoResolveAgentAnswer"],
      "properties": {
        "enabled": { "type": "boolean" },
        "viewedMode": { "const": "manual" },
        "staleOnFingerprintChange": { "type": "boolean" },
        "autoResolveAgentAnswer": { "const": false }
      }
    },
    "feedback": {
      "type": "object",
      "additionalProperties": false,
      "required": ["target", "delivery", "neverCreateNewSession"],
      "properties": {
        "target": { "const": "origin-session" },
        "delivery": { "enum": ["return-to-session", "direct-same-session", "export-only"] },
        "directSameSessionBridge": { "enum": ["auto", "disabled"] },
        "neverCreateNewSession": { "const": true },
        "contextPreview": { "const": "required" },
        "maxBatchItems": { "type": "integer", "minimum": 1, "maximum": 100 },
        "maxContextBytes": { "type": "integer", "minimum": 1024, "maximum": 10485760 }
      }
    },
    "policy": {
      "type": "object",
      "additionalProperties": false,
      "required": ["failOn", "warnOn"],
      "properties": {
        "failOn": { "type": "array", "items": { "type": "string" }, "uniqueItems": true },
        "warnOn": { "type": "array", "items": { "type": "string" }, "uniqueItems": true }
      }
    }
  },
  "$defs": {
    "server": {
      "type": "object",
      "additionalProperties": false,
      "required": ["readyUrl"],
      "properties": {
        "command": {
          "type": "array",
          "minItems": 1,
          "items": { "type": "string", "minLength": 1 }
        },
        "cwd": { "type": "string", "minLength": 1 },
        "readyUrl": { "type": "string", "format": "uri" },
        "readySelector": { "type": "string", "minLength": 1 },
        "shutdownTimeoutMs": { "type": "integer", "minimum": 1, "maximum": 30000 }
      }
    },
    "viewport": {
      "type": "object",
      "additionalProperties": false,
      "required": ["width", "height", "deviceScaleFactor"],
      "properties": {
        "width": { "type": "integer", "minimum": 1, "maximum": 10000 },
        "height": { "type": "integer", "minimum": 1, "maximum": 30000 },
        "deviceScaleFactor": { "type": "number", "minimum": 0.25, "maximum": 4 }
      }
    },
    "target": {
      "type": "object",
      "additionalProperties": false,
      "required": ["id", "path", "viewports", "states"],
      "properties": {
        "id": { "type": "string", "pattern": "^[a-z0-9][a-z0-9-]*$" },
        "path": { "type": "string", "pattern": "^/" },
        "viewports": {
          "type": "array",
          "minItems": 1,
          "items": { "type": "string" },
          "uniqueItems": true
        },
        "roots": { "type": "array", "items": { "type": "string" } },
        "fragments": {
          "type": "object",
          "additionalProperties": false,
          "required": ["before", "after"],
          "properties": {
            "before": { "type": "string", "minLength": 1 },
            "after": { "type": "string", "minLength": 1 }
          }
        },
        "states": {
          "type": "array",
          "minItems": 1,
          "items": {
            "type": "object",
            "additionalProperties": false,
            "required": ["name"],
            "properties": {
              "name": { "type": "string", "minLength": 1 },
              "steps": { "type": "array", "items": { "type": "object" } }
            }
          }
        }
      }
    }
  }
}
